,tweet_id,timestamp,text,rating_numerator,rating_denominator,doggo,floofer,pupper,puppo,dog_breed,display_text_range,retweet_count,favorite_count
573,750071704093859840,2016-07-04 21:00:04,Pause your cookout and admire this pupper's nifty hat. 10/10 https://t.co/RG4C9IdNJM,10,10,False,False,True,False,redbone,60,3802,8653
579,749417653287129088,2016-07-03 01:41:06,This is Finn. He's the most unphotogenic pupper of all time. 11/10 https://t.co/qvA2rCUl6v,11,10,False,False,True,False,papillon,66,1904,6721
582,749317047558017024,2016-07-02 19:01:20,This is Blu. He's a wild bush Floofer. I wish anything made me as happy as bushes make Blu. 12/10 would frolic with https://t.co/HHUAnBb6QB,12,10,False,True,False,False,wire-haired_fox_terrier,115,2509,6076
585,748932637671223296,2016-07-01 17:33:49,Say hello to Divine Doggo. Must be magical af. 13/10 would be an honor to pet https://t.co/BbcABzohKb,13,10,True,False,False,False,borzoi,77,2564,6461
590,747963614829678593,2016-06-29 01:23:16,PUPPER NOOOOO BEHIND YOUUU 10/10 pls keep this pupper in your thoughts https://t.co/ZPfeRtOX0Q,10,10,False,False,True,False,kelpie,70,2444,6397
606,746056683365994496,2016-06-23 19:05:49,This is Arlen and Thumpelina. They are best pals. Cuddly af. 11/10 for both puppers https://t.co/VJgbgIzIHx,11,10,False,False,True,False,Shetland_sheepdog,83,931,3904
610,744995568523612160,2016-06-20 20:49:19,This is Abby. She got her face stuck in a glass. Churlish af. 9/10 rookie move puppo https://t.co/2FPb45NXrK,9,10,False,False,False,True,Old_English_sheepdog,84,716,3277
614,744234799360020481,2016-06-18 18:26:18,Here's a doggo realizing you can stand in a pool. 13/10 enlightened af (vid by Tina Conrad) https://t.co/7wE9LTEXC4,13,10,True,False,False,False,Labrador_retriever,91,79515,131075
618,743253157753532416,2016-06-16 01:25:36,"This is Kilo. He cannot reach the snackum. Nifty tongue, but not nifty enough. 10/10 maybe one day puppo https://t.co/gSmp31Zrsx",10,10,False,False,False,True,malamute,104,1366,4624
619,743222593470234624,2016-06-15 23:24:09,This is a very rare Great Alaskan Bush Pupper. Hard to stumble upon without spooking. 12/10 would pet passionately https://t.co/xOBKCdpzaa,12,10,False,False,True,False,kuvasz,114,2164,6792
624,741743634094141440,2016-06-11 21:27:17,Meet Aqua. She's a sandy pupper. Not sure how she feels about being so sandy. Radical tongue slip. 11/10 petable af https://t.co/rYxJ0UQtbE,11,10,False,False,True,False,Labrador_retriever,115,3144,8945
627,741067306818797568,2016-06-10 00:39:48,This is just downright precious af. 12/10 for both pupper and doggo https://t.co/o5J479bZUC,12,10,True,False,True,False,golden_retriever,67,3520,10342
635,739606147276148736,2016-06-05 23:53:41,Meet Benji. He just turned 1. Has already given up on a traditional pupper physique. Just inhaled that thing. 9/10 https://t.co/sLUC4th3Zj,9,10,False,False,True,False,Blenheim_spaniel,114,1876,5897
638,739238157791694849,2016-06-04 23:31:25,Here's a doggo blowing bubbles. It's downright legendary. 13/10 would watch on repeat forever (vid by Kent Duryee) https://t.co/YcXgHfp1EC,13,10,True,False,False,False,Eskimo_dog,114,52360,75163
640,738537504001953792,2016-06-03 01:07:16,This is Bayley. She fell asleep trying to escape her evil fence enclosure. 11/10 night night puppo https://t.co/AxSiqAKEKu,11,10,False,False,False,True,chow,98,1759,5575
648,737445876994609152,2016-05-31 00:49:32,Just wanted to share this super rare Rainbow Floofer in case you guys haven't seen it yet. 13/10 colorful af https://t.co/CaG9MzD3WT,13,10,False,True,False,False,Samoyed,108,5048,11302
653,735648611367784448,2016-05-26 01:47:51,*faints* 12/10 perfection in pupper form https://t.co/t6TxTwTLEK,12,10,False,False,True,False,Pembroke,40,1237,4397
655,735256018284875776,2016-05-24 23:47:49,This is Kellogg. He accidentally opened the front facing camera. 8/10 get it together doggo https://t.co/MRYv7nDPyS,8,10,True,False,False,False,Staffordshire_bullterrier,91,993,3675
656,735137028879360001,2016-05-24 15:55:00,Meet Buckley. His family &amp; some neighbors came over to watch him perform but he's nervous af. 9/10 u got this pupper https://t.co/5bdCpPlno9,9,10,False,False,True,False,Walker_hound,120,1092,3428
661,733822306246479872,2016-05-21 00:50:46,This is Moose. He's a Polynesian Floofer. Dapper af. 10/10 would pet diligently https://t.co/mVfqRdppTL,10,10,False,True,False,False,Lhasa,79,1141,4015
664,733109485275860992,2016-05-19 01:38:16,"Like father (doggo), like son (pupper). Both 12/10 https://t.co/pG2inLaOda",12,10,True,False,True,False,golden_retriever,50,17621,44619
669,730573383004487680,2016-05-12 01:40:42,This is Rooney. He can't comprehend glass. 10/10 it'll be ok pupper https://t.co/CnUl2uDBBV,10,10,False,False,True,False,American_Staffordshire_terrier,67,2435,5407
679,728015554473250816,2016-05-05 00:16:48,This is Rueben. He has reached ultimate pupper zen state. 11/10 tranquil af https://t.co/Z167HgtnBi,11,10,False,False,True,False,cocker_spaniel,75,1219,4479
681,727644517743104000,2016-05-03 23:42:26,Here's a doggo struggling to cope with the winds. 13/10 https://t.co/qv3aUwaouT,13,10,True,False,False,False,Great_Pyrenees,55,1962,6431
682,727524757080539137,2016-05-03 15:46:33,This pupper had to undergo emergency haircut surgery so he could hear again. 10/10 miraculous af https://t.co/fUyDIFkBwx,10,10,False,False,True,False,Pomeranian,96,1379,4900
683,727314416056803329,2016-05-03 01:50:44,This pupper was about to explain where that dirt came from but then decided against it. 11/10 https://t.co/SbaelU6zRs,11,10,False,False,True,False,toy_poodle,93,834,3623
689,725786712245440512,2016-04-28 20:40:11,Say hello to Lillie. She's a Rutabagan Floofem. Poor pupper ate and then passed out. 11/10 relatable af https://t.co/uIdGqug9rw,11,10,False,False,True,False,chow,103,1527,4537
692,724771698126512129,2016-04-26 01:26:53,Nothin better than a doggo and a sunset. 11/10 https://t.co/JlFqOhrHEs,11,10,True,False,False,False,German_short-haired_pointer,46,725,2593
693,724405726123311104,2016-04-25 01:12:38,This is Ashleigh. She's having Coachella withdrawals. Didn't even go tho. 10/10 stay strong pupper https://t.co/nRUaKWnJfH,10,10,False,False,True,False,golden_retriever,98,1847,5800
700,721001180231503872,2016-04-15 15:44:11,This is Oliver. Bath time is upon him. His fear of the wetness postpones his ultimate pupper destiny. 11/10 https://t.co/AFzzKqR4tT,11,10,False,False,True,False,Samoyed,131,686,2748
707,719991154352222208,2016-04-12 20:50:42,This doggo was initially thrilled when she saw the happy cartoon pup but quickly realized she'd been deceived. 10/10 https://t.co/mvnBGaWULV,10,10,True,False,False,False,golden_retriever,140,1979,5281
722,717009362452090881,2016-04-04 15:22:08,This is Smokey. He's having some sort of existential crisis. 10/10 hang in there pupper https://t.co/JmgF4dMpw0,10,10,False,False,True,False,Siberian_husky,111,1102,3583
726,716080869887381504,2016-04-02 01:52:38,Here's a super majestic doggo and a sunset 11/10 https://t.co/UACnoyi8zu,11,10,True,False,False,False,golden_retriever,72,1935,5272
736,714606013974974464,2016-03-29 00:12:05,Here are two lil cuddly puppers. Both 12/10 would snug like so much https://t.co/zO4eb7C4tG,12,10,False,False,True,False,Norfolk_terrier,91,1038,3938
752,711008018775851008,2016-03-19 01:54:56,This is Chuckles. He had a balloon but he accidentally let go of it and it floated away. 11/10 hang in there pupper https://t.co/68iNM7B5gW,11,10,False,False,True,False,French_bulldog,139,710,3275
760,710117014656950272,2016-03-16 14:54:24,This pupper got her hair chalked for her birthday. Hasn't told her parents yet. Rebellious af. 11/10 very nifty https://t.co/h1OX2mLtxV,11,10,False,False,True,False,toy_poodle,135,2233,5999
771,708845821941387268,2016-03-13 02:43:08,Here's a pupper with magic eyes. Not wearing a seat belt tho (irresponsible af). Very distracting to driver. 9/10 https://t.co/5DLJB4ssvI,9,10,False,False,True,False,schipperke,137,1015,3226
787,707411934438625280,2016-03-09 03:45:22,"""I shall trip the big pupper with leash. Big pupper will never see it coming. I am a genius."" Both 11/10 https://t.co/uQsCJ8pf51",11,10,False,False,True,False,Lakeland_terrier,128,673,2486
790,707315916783140866,2016-03-08 21:23:50,This is Finnegus. He's trapped in a snow globe. Poor pupper. 10/10 would make sure no one shook it https://t.co/BjpOa52jQ4,10,10,False,False,True,False,Bernese_mountain_dog,122,727,2698
800,706310011488698368,2016-03-06 02:46:44,Here's a very sleepy pupper. Thinks it's an airplane. 12/10 would snug for eternity https://t.co/GGmcTIkBbf,12,10,False,False,True,False,Pembroke,107,9034,23443
804,705975130514706432,2016-03-05 04:36:02,This is Adele. Her tongue flies out of her mouth at random. It's a debilitating illness. 10/10 stay strong pupper https://t.co/cfn81n3FLO,10,10,False,False,True,False,Staffordshire_bullterrier,137,842,3397
810,705428427625635840,2016-03-03 16:23:38,This is Ambrose. He's an Alfalfa Ballyhoo. Draws pistol fast af. Pretty much runs the frontier. 11/10 lethal pupper https://t.co/ih6epBOxIA,11,10,False,False,True,False,Chihuahua,139,1931,4188
815,704859558691414016,2016-03-02 02:43:09,Here is a heartbreaking scene of an incredible pupper being laid to rest. 10/10 RIP pupper https://t.co/81mvJ0rGRu,10,10,False,False,True,False,pug,114,612,2462
822,703611486317502464,2016-02-27 16:03:45,Meet Scooter. He's experiencing the pupper equivalent of dropping ur phone in a toilet 10/10 put it in some rice pup https://t.co/JSmX1FIEaW,10,10,False,False,True,False,Pembroke,140,1709,4229
829,702598099714314240,2016-02-24 20:56:55,"This is Sansa. She's gotten too big for her chair. Not so smol anymore. 11/10 once a pupper, always a pupper https://t.co/IpAoztle2s",11,10,False,False,True,False,kelpie,132,3712,11332
839,701545186879471618,2016-02-21 23:13:01,Meet Millie. She's practicing her dive form for Rio. It's nearly perfect. Dedicated af. 10/10 go for gold pupper https://t.co/SDVkc4m96M,10,10,False,False,True,False,Border_collie,136,680,2902
841,700864154249383937,2016-02-20 02:06:50,"""Pupper is a present to world. Here is a bow for pupper."" 12/10 precious as hell https://t.co/ItSsE92gCW",12,10,False,False,True,False,kuvasz,104,685,2828
846,700143752053182464,2016-02-18 02:24:13,When it's Janet from accounting's birthday but you can't eat the cake cuz it's chocolate. 10/10 hang in there pupper https://t.co/Fbdr5orUrJ,10,10,False,False,True,False,golden_retriever,140,3129,8282
849,699801817392291840,2016-02-17 03:45:29,This is Cooper. He began to tear up when his bone was taken from him. 11/10 stay strong pupper https://t.co/qI8yvqKG02,11,10,False,False,True,False,golden_retriever,118,1088,3345
854,699434518667751424,2016-02-16 03:25:58,I know this is a tad late but here's a wonderful Valentine's Day pupper 12/10 https://t.co/hTE2PEwGvi,12,10,False,False,True,False,golden_retriever,101,577,2384
861,699036661657767936,2016-02-15 01:05:02,HAPPY V-DAY FROM YOUR FAV PUPPER SQUAD 13/10 for all https://t.co/7u6VnZ1UFe,13,10,False,False,True,False,Chihuahua,76,1345,2863
877,697616773278015490,2016-02-11 03:02:54,This pupper doubles as a hallway rug. Very rare. Versatile af. 11/10 https://t.co/Jxd5pR02Cn,11,10,False,False,True,False,Lhasa,92,1144,3467
878,697596423848730625,2016-02-11 01:42:02,Here's a pupper with a piece of pizza. Two of everybody's favorite things in one photo. 11/10 https://t.co/5USjFjKI7Z,11,10,False,False,True,False,Shetland_sheepdog,117,1425,3306
894,695095422348574720,2016-02-04 04:03:57,This is just a beautiful pupper good shit evolution. 12/10 https://t.co/2L8pI0Z2Ib,12,10,False,False,True,False,papillon,82,684,2888
895,695074328191332352,2016-02-04 02:40:08,This is Lorenzo. He's educated af. Just graduated college. 11/10 poor pupper can't even comprehend his debt https://t.co/dH3GzcjCtQ,11,10,False,False,True,False,Shih-Tzu,131,1239,3116
898,694329668942569472,2016-02-02 01:21:07,Meet Grady. He's very hungry. Too bad no one can find his food bowl. 9/10 poor pupper https://t.co/oToIkYnEGn,9,10,False,False,True,False,boxer,109,569,2203
903,693629975228977152,2016-01-31 03:00:47,This pupper is afraid of its own feet. 12/10 would comfort https://t.co/Tn9Mp0oPoJ,12,10,False,False,True,False,pug,82,894,2685
906,693262851218264065,2016-01-30 02:41:58,I hope you guys enjoy this beautiful snowy pupper as much as I did. 11/10 https://t.co/DYUsHtL2aR,11,10,False,False,True,False,golden_retriever,97,568,2459
911,692905862751522816,2016-01-29 03:03:25,This is Wally. He's being abducted by aliens. 10/10 poor pupper https://t.co/EiF659Bgjn,10,10,False,False,True,False,Mexican_hairless,87,998,2683
914,692828166163931137,2016-01-28 21:54:41,This pupper just descended from heaven. 12/10 can probably fly https://t.co/X6X9wM7NuS,12,10,False,False,True,False,Samoyed,86,998,3148
915,692752401762250755,2016-01-28 16:53:37,"""Hello yes could I get one pupper to go please thank you""
Both 13/10 https://t.co/kYWcXbluUu",13,10,False,False,True,False,Samoyed,92,4124,7496
931,690959652130045952,2016-01-23 18:09:53,This golden is happy to refute the soft mouth egg test. Not a fan of sweeping generalizations. 11/10 #notallpuppers https://t.co/DgXYBDMM3E,11,10,False,False,True,False,golden_retriever,139,1421,3902
938,690015576308211712,2016-01-21 03:38:27,This pupper can only sleep on shoes. It's a crippling disease. Tearing his family apart. 12/10 I'd totally pet tho https://t.co/03XlvS8izg,12,10,False,False,True,False,malamute,138,836,2740
941,689905486972461056,2016-01-20 20:21:00,"Say hello to Gizmo. He's quite the pupper. Confused by bed, but agile af. Can barely catch on camera. 11/10 so quick https://t.co/IE4ZblyZRY",11,10,False,False,True,False,Pomeranian,140,787,2651
945,689623661272240129,2016-01-20 01:41:08,This is Lucy. She's terrified of the stuffed billed dog. 10/10 stay strong pupper https://t.co/QnvSjjyh7n,10,10,False,False,True,False,toy_poodle,105,748,2467
952,689143371370250240,2016-01-18 17:52:38,Meet Trip. He likes wearing costumes that aren't consistent with the season to screw with people 10/10 tricky pupper https://t.co/40w7TI5Axv,10,10,False,False,True,False,English_springer,140,579,2232
953,688916208532455424,2016-01-18 02:49:58,This pupper just wants to say hello. 11/10 would knock down fence for https://t.co/A8X8fwS78x,11,10,False,False,True,False,Pembroke,93,983,3003
959,688519176466644993,2016-01-17 00:32:18,This pupper is sprouting a flower out of her head. 12/10 revolutionary af https://t.co/glmvQBRjv4,12,10,False,False,True,False,Pembroke,97,825,2520
964,687818504314159109,2016-01-15 02:08:05,With great pupper comes great responsibility. 12/10 https://t.co/hK6xB042EP,12,10,False,False,True,False,Lakeland_terrier,75,1080,2758
966,687704180304273409,2016-01-14 18:33:48,Say hello to Blakely. He thinks that's a hat. Silly pupper. That's a nanner. 9/10 https://t.co/UwOV1jqKRt,9,10,False,False,True,False,miniature_pinscher,105,950,2660
974,687096057537363968,2016-01-13 02:17:20,This pupper's New Year's resolution was to become a Hershey's kiss. 11/10 she's super pumped about it https://t.co/D7jYj6vdwC,11,10,False,False,True,False,Labrador_retriever,125,695,2449
976,686683045143953408,2016-01-11 22:56:10,This is Mona. She's a Yarborough Splishnsplash. Lost body during Nam. 11/10 revolutionary pupper https://t.co/pgD6h0yhgz,11,10,False,False,True,False,Norwich_terrier,120,912,3072
977,686618349602762752,2016-01-11 18:39:05,This is Olivia. She just saw an adult wearing crocs. 11/10 poor pupper. No one should witness such a thing https://t.co/yJVTi1DjJc,11,10,False,False,True,False,Rottweiler,130,1544,4042
980,686377065986265092,2016-01-11 02:40:19,Meet Birf. He thinks he's gone blind. 10/10 very frightened pupper https://t.co/oDkspjNWYX,10,10,False,False,True,False,German_shepherd,90,637,2433
984,686007916130873345,2016-01-10 02:13:27,This pupper has a magical eye. 11/10 I can't stop looking at it https://t.co/heAGpKTpPW,11,10,False,False,True,False,Rhodesian_ridgeback,87,472,2704
986,685943807276412928,2016-01-09 21:58:42,This is the newly formed pupper a capella group. They're just starting out but I see tons of potential. 8/10 for all https://t.co/wbAcvFoNtn,8,10,False,False,True,False,papillon,140,696,1801
989,685641971164143616,2016-01-09 01:59:19,This is Otis. He just passed a cop while going 61 in a 45. Very nervous pupper. 7/10 https://t.co/jJS8qQeuNO,7,10,False,False,True,False,Lakeland_terrier,108,885,3218
993,685307451701334016,2016-01-08 03:50:03,Say hello to Petrick. He's an Altostratus Floofer. Just had a run in with a trash bag. Groovy checkered floor. 11/10 https://t.co/rwW7z1JAOF,11,10,False,True,False,False,Pomeranian,140,496,2262
994,685268753634967552,2016-01-08 01:16:17,This is Hubertson. He's a Carmel Haberdashery. Enjoys long summer days on his boat. Very peaceful pupper. 10/10 https://t.co/vzCl35fKlZ,10,10,False,False,True,False,pug,135,1371,3419
995,685169283572338688,2016-01-07 18:41:01,Meet Gerbald. He just found out he's adopted. Poor pupper. Snazzy tongue tho. 11/10 would hold close in time of need https://t.co/UfGkB9Wrud,11,10,False,False,True,False,Bernese_mountain_dog,140,1620,4489
1009,683857920510050305,2016-01-04 03:50:08,Meet Sadie. She fell asleep on the beach and her friends buried her. 10/10 can't trust fellow puppers these days https://t.co/LoKVvc1xAW,10,10,False,False,True,False,bluetick,136,1262,4163
1011,683834909291606017,2016-01-04 02:18:42,Here we see a faulty pupper. Might need to replace batteries. Try turning off &amp; back on again. 9/10 would still pet https://t.co/O1E4AtHVxO,9,10,False,False,True,False,Maltese_dog,143,1265,2880
1012,683828599284170753,2016-01-04 01:53:37,Breathtaking pupper here. Should be on the cover of Dogue. Top-notch tongue. Appears considerably fluffy. 12/10 https://t.co/Eeh3yfdglS,12,10,False,False,True,False,malamute,135,1195,3053
1016,683481228088049664,2016-01-03 02:53:17,Meet Banjo. He's a Peppercorn Shoop Da Whoop. Nails look lethal. Skeptical of luminescent orb 11/10 stay woke pupper https://t.co/H7NZFumpKq,11,10,False,False,True,False,keeshond,140,1118,2878
1017,683462770029932544,2016-01-03 01:39:57,"""Hello forest pupper I am house pupper welcome to my abode"" (8/10 for both) https://t.co/qFD8217fUT",8,10,False,False,True,False,Italian_greyhound,99,761,2676
1021,683142553609318400,2016-01-02 04:27:31,Meet Brandy. She's a member of the Bloods. Menacing criminal pupper. Soft spot for flowers tho. 9/10 pet w caution https://t.co/hhIA3coiAJ,9,10,False,False,True,False,Leonberg,138,1173,3162
1022,683111407806746624,2016-01-02 02:23:45,This is Larry. He thought the New Year's parties were tonight. 10/10 poor pupper. Maybe next year https://t.co/h3X0jK8MVM,10,10,False,False,True,False,cocker_spaniel,121,1034,3736
1034,681891461017812993,2015-12-29 17:36:07,Say hello to Charlie. He's scholarly af. Quite intimidating with all his pupper knowledge 10/10 even built that fire https://t.co/9KThv6z8u5,10,10,False,False,True,False,Chihuahua,140,951,2706
1035,681694085539872773,2015-12-29 04:31:49,This is Bo. He's a Benedoop Cumbersnatch. Seems frustrated with own feet. Portable as hell. 11/10 very solid pupper https://t.co/TONMhRoQh7,11,10,False,False,True,False,toy_poodle,139,4581,14010
1036,681654059175129088,2015-12-29 01:52:46,This is Toffee. He's a happy pupper. Appears dangerously fluffy. Extraordinarily spherical. 12/10 would pet firmly https://t.co/oEXEKt3MHu,12,10,False,False,True,False,Pomeranian,138,1045,2903
1044,681231109724700672,2015-12-27 21:52:07,I just love this pic. 11/10 this pupper is going places https://t.co/P16uhh1PbI,11,10,False,False,True,False,Irish_setter,79,540,2629
1051,680836378243002368,2015-12-26 19:43:36,This is Ellie. She's secretly ferocious. 12/10 very deadly pupper https://t.co/BF4BW8LUgb,12,10,False,False,True,False,Pembroke,89,1513,3766
1055,680494726643068929,2015-12-25 21:06:00,Here we have uncovered an entire battalion of holiday puppers. Average of 11.26/10 https://t.co/eNm2S6p9BD,26,10,False,False,True,False,kuvasz,106,542,1879
1056,680473011644985345,2015-12-25 19:39:43,"This is Hector. He thinks he's a hammer. Silly Hector. You're a pupper, not a hammer. 10/10 https://t.co/OdUFuZIXiI",10,10,False,False,True,False,Lakeland_terrier,115,844,2778
1057,680191257256136705,2015-12-25 01:00:07,Here's a sleepy Christmas pupper 11/10 https://t.co/KXg0f8GNQ9,11,10,False,False,True,False,Brittany_spaniel,62,577,2356
1059,680145970311643136,2015-12-24 22:00:10,Say hello to Kawhi. He was doing fine until his hat fell off. He got it back though. 10/10 deep breaths pupper https://t.co/N5pM6WBx7e,10,10,False,False,True,False,miniature_poodle,134,1972,3955
1062,680100725817409536,2015-12-24 19:00:23,This pupper is not coming inside until she catches a snowflake on her tongue. 11/10 the determination is palpable https://t.co/lvMYbmKq8H,11,10,False,False,True,False,golden_retriever,137,1554,3891
1066,679828447187857408,2015-12-24 00:58:27,Everybody look at this beautiful pupper 13/10 https://t.co/hyAC5Hq9GC,13,10,False,False,True,False,Chihuahua,69,15839,39726
1067,679777920601223168,2015-12-23 21:37:40,This is Rinna. She's melting. 10/10 get inside pupper https://t.co/PA0czwucsb,10,10,False,False,True,False,bloodhound,77,1281,3390
1080,678800283649069056,2015-12-21 04:52:53,Here's a pupper with some mean tan lines. Snazzy sweater though 12/10 https://t.co/DpCSVsl6vu,12,10,False,False,True,False,Labrador_retriever,93,1018,2810
1090,678389028614488064,2015-12-20 01:38:42,"This is Bella. She just learned that her final grade in chem was a 92.49 
poor pupper 11/10 https://t.co/auOoKuoveM",11,10,False,False,True,False,miniature_pinscher,115,473,2044
1091,678341075375947776,2015-12-19 22:28:09,This pupper likes tape. 12/10 https://t.co/cSp6w5GWgm,12,10,False,False,True,False,golden_retriever,53,612,1896
1093,678278586130948096,2015-12-19 18:19:51,Another spooky pupper here. Most definitely floating. No legs. Probably knows some dark magic. 10/10 very spooked https://t.co/JK8MByRzgj,10,10,False,False,True,False,Maltese_dog,137,6857,12531
1110,677269281705472000,2015-12-16 23:29:14,This is the happiest pupper I've ever seen. 10/10 would trade lives with https://t.co/ep8ATEJwRb,10,10,False,False,True,False,Shetland_sheepdog,96,790,2164
1116,676936541936185344,2015-12-16 01:27:03,Here we see a rare pouched pupper. Ample storage space. Looks alert. Jumps at random. Kicked open that door. 8/10 https://t.co/mqvaxleHRz,8,10,False,False,True,False,Chesapeake_Bay_retriever,137,5515,13809
1120,676617503762681856,2015-12-15 04:19:18,I promise this wasn't meant to be a cuteness overload account but ermergerd look at this cozy pupper. 13/10 https://t.co/mpQl2rJjDh,13,10,False,False,True,False,Chihuahua,131,1108,3149
1121,676603393314578432,2015-12-15 03:23:14,This is Godzilla pupper. He had a ruff childhood &amp; now deflects that pain outward by terrorizing cities. Tragic 9/10 https://t.co/g1tLGkyaxr,9,10,False,False,True,False,whippet,144,440,1280
1125,676470639084101634,2015-12-14 18:35:43,Three generations of pupper. 11/10 for all https://t.co/tAmQYvzrau,11,10,False,False,True,False,golden_retriever,66,5224,12616
1126,676440007570247681,2015-12-14 16:34:00,Hope your Monday isn't too awful. Here's two baseball puppers. 11/10 for each https://t.co/dB0H9hdZai,11,10,False,False,True,False,Maltese_dog,101,748,1863
1133,675898130735476737,2015-12-13 04:40:46,I'm sure you've all seen this pupper. Not prepared at all for the flying disc of terror. 10/10 https://t.co/G0pQiFGM7O,10,10,False,False,True,False,Labrador_retriever,118,653,1774
1137,675845657354215424,2015-12-13 01:12:15,"This is Pepper. She's not fully comfortable riding her imaginary bike yet. 10/10 don't worry pupper, it gets easier https://t.co/40dj4eTsXG",10,10,False,False,True,False,pug,139,1000,2477
1139,675820929667219457,2015-12-12 23:34:00,Here's a handful of sleepy puppers. All look unaware of their surroundings. Lousy guard dogs. Still cute tho 11/10s https://t.co/lyXX3v5j4s,11,10,False,False,True,False,basset,139,260,1140
1142,675740360753160193,2015-12-12 18:13:51,Here's a pupper licking in slow motion. 12/10 please enjoy https://t.co/AUJi8ujxw9,12,10,False,False,True,False,golden_retriever,82,388,1257
1151,675432746517426176,2015-12-11 21:51:30,Happy Friday. Here's some golden puppers. 12/10 for all https://t.co/wNkqAED6lG,12,10,False,False,True,False,Labrador_retriever,79,627,1623
1155,675334060156301312,2015-12-11 15:19:21,Good morning here's a grass pupper. 12/10 https://t.co/2d68FmWGGs,12,10,False,False,True,False,Pembroke,65,1436,3007
1162,675006312288268288,2015-12-10 17:37:00,Say hello to Mollie. This pic was taken after she bet all her toys on Ronda Rousey. 10/10 hang in there pupper https://t.co/QMmAqA9VqO,10,10,False,False,True,False,boxer,134,252,1057
1170,674774481756377088,2015-12-10 02:15:47,This is Superpup. His head isn't proportional to his body. Has yet to serve any justice. 11/10 maybe one day pupper https://t.co/gxIFgg8ktm,11,10,False,False,True,False,Chihuahua,139,532,1213
1175,674737130913071104,2015-12-09 23:47:22,Meet Rufio. He is unaware of the pink legless pupper wrapped around him. Might want to get that checked 10/10 &amp; 4/10 https://t.co/KNfLnYPmYh,10,10,False,False,True,False,Pomeranian,144,103,693
1178,674638615994089473,2015-12-09 17:15:54,This pupper is fed up with being tickled. 12/10 I'm currently working on an elaborate heist to steal this dog https://t.co/F33n1hy3LL,12,10,False,False,True,False,Pomeranian,133,650,1806
1180,674447403907457024,2015-12-09 04:36:06,This pupper just wants a belly rub. This pupper has nothing to do w the tree being sideways now. 10/10 good pupper https://t.co/AyJ7Ohk71f,10,10,False,False,True,False,Brabancon_griffon,138,393,1137
