,tweet_id,timestamp,text,rating_numerator,rating_denominator,doggo,floofer,pupper,puppo,dog_breed,display_text_range,retweet_count,favorite_count
7,890240255349198849,2017-07-26 15:59:51,This is Cassie. She is a college pup. Studying international doggo communication and stick theory. 14/10 so elegant much sophisticate https://t.co/t1bfwz5S2A,14,10,True,False,False,False,Pembroke,133,7711,32467
10,889665388333682689,2017-07-25 01:55:32,Here's a puppo that seems to be on the fence about something haha no but seriously someone help her. 13/10 https://t.co/BxvuXk0UCm,13,10,False,False,False,True,Pembroke,106,8538,38818
12,889531135344209921,2017-07-24 17:02:04,This is Stuart. He's sporting his favorite fanny pack. Secretly filled with bones only. 13/10 puppared puppo #BarkWeek https://t.co/y70o6h3isq,13,10,False,False,False,True,golden_retriever,118,2321,15359
24,886366144734445568,2017-07-15 23:25:31,This is Roscoe. Another pupper fallen victim to spontaneous tongue ejections. Get the BlepiPen immediate. 12/10 deep breaths Roscoe https://t.co/RGE08MIJox,12,10,False,False,True,False,French_bulldog,131,3316,21524
33,884162670584377345,2017-07-09 21:29:42,Meet Yogi. He doesn't have any important dog meetings today he just enjoys looking his best at all times. 12/10 for dangerously dapper doggo https://t.co/YSI00BzTBZ,12,10,True,False,False,False,German_shepherd,140,3128,20771
36,883360690899218434,2017-07-07 16:22:55,Meet Grizzwald. He may be the floofiest floofer I ever did see. Lost eyes saving a schoolbus from a volcano erpuption. 13/10 heroic as h*ck https://t.co/rf661IFEYP,13,10,False,True,False,False,chow,139,3825,22986
39,882762694511734784,2017-07-06 00:46:41,This is Gus. He's quite the cheeky pupper. Already perfected the disinterested wink. 12/10 would let steal my girl https://t.co/D43I96SlVu,12,10,False,False,True,False,Labrador_retriever,114,5134,28903
43,881666595344535552,2017-07-03 00:11:11,This is Gary. He couldn't miss this puppertunity for a selfie. Flawless focusing skills. 13/10 would boop intensely https://t.co/7CSWCl8I6s,13,10,False,False,True,False,Saluki,115,11099,51522
44,881536004380872706,2017-07-02 15:32:16,"Here is a pupper approaching maximum borkdrive. Zooming at never before seen speeds. 14/10 paw-inspiring af 
(IG: puffie_the_chow) https://t.co/ghXBIIeQZF",14,10,False,False,True,False,Samoyed,130,16570,50199
53,878776093423087618,2017-06-25 00:45:22,This is Snoopy. He's a proud #PrideMonthPuppo. Impeccable handwriting for not having thumbs. 13/10 would love back #PrideMonth https://t.co/lNZwgNO4gS,13,10,False,False,False,True,Italian_greyhound,126,4319,19763
60,876838120628539392,2017-06-19 16:24:33,This is Ginger. She's having a ruff Monday. Too many pupper things going on. H*ckin exhausting. 12/10 would snug passionately https://t.co/j211oCDRs6,12,10,False,False,True,False,bloodhound,125,3506,21125
62,876120275196170240,2017-06-17 16:52:05,"Meet Venti, a seemingly caffeinated puppoccino. She was just informed the weekend would include walks, pats and scritches. 13/10 much excite https://t.co/ejExJFq3ek",13,10,False,False,False,True,Bernese_mountain_dog,140,4903,28490
67,874296783580663808,2017-06-12 16:06:11,This is Jed. He may be the fanciest pupper in the game right now. Knows it too. 13/10 would sign modeling contract https://t.co/0YplNnSMEm,13,10,False,False,True,False,cocker_spaniel,114,4308,26651
69,874012996292530176,2017-06-11 21:18:31,"This is Sebastian. He can't see all the colors of the rainbow, but he can see that this flag makes his human happy. 13/10 #PrideMonth puppo https://t.co/XBE0evJZ6V",13,10,False,False,False,True,Cardigan,139,11007,35501
71,873213775632977920,2017-06-09 16:22:42,"This is Sierra. She's one precious pupper. Absolute 12/10. Been in and out of ICU her whole life. Help Sierra below

https://t.co/Xp01EU3qyD https://t.co/V5lkvrGLdQ",12,10,False,False,True,False,vizsla,140,1667,7467
72,872967104147763200,2017-06-09 00:02:31,Here's a very large dog. He has a date later. Politely asked this water person to check if his breath is bad. 12/10 good to go doggo https://t.co/EMYIdoblMR,12,10,True,False,False,False,Labrador_retriever,132,5669,28031
77,871879754684805121,2017-06-06 00:01:46,Say hello to Lassie. She's celebrating #PrideMonth by being a splendid mix of astute and adorable. Proudly supupporting her owner. 13/10 https://t.co/uK6PNyeh9w,13,10,False,False,False,True,Shetland_sheepdog,136,11918,39090
78,871762521631449091,2017-06-05 16:15:56,This is Rover. As part of pupper protocol he had to at least attempt to eat the plant. Confirmed not tasty. Needs peanut butter. 12/10 https://t.co/AiVljI6QCg,12,10,False,False,True,False,Labrador_retriever,134,3678,20787
79,871515927908634625,2017-06-04 23:56:03,This is Napolean. He's a Raggedy East Nicaraguan Zoom Zoom. Runs on one leg. Built for deception. No eyes. Good with kids. 12/10 great doggo https://t.co/PR7B7w1rUw,12,10,True,False,False,False,komondor,140,3628,20730
86,869596645499047938,2017-05-30 16:49:31,This is Scout. He just graduated. Officially a doggo now. Have fun with taxes and losing sight of your ambitions. 12/10 would throw cap for https://t.co/DsA2hwXAJo,12,10,True,False,False,False,Chihuahua,139,3327,16476
92,867421006826221569,2017-05-24 16:44:18,This is Shikha. She just watched you drop a skittle on the ground and still eat it. Could not be less impressed. 12/10 superior puppo https://t.co/XZlZKd73go,12,10,False,False,False,True,Eskimo_dog,133,2697,16755
94,866686824827068416,2017-05-22 16:06:55,This is Lili. She can't believe you betrayed her with bath time. Never looking you in the eye again. 12/10 would puppologize profusely https://t.co/9b9J46E86Z,12,10,False,False,False,True,flat-coated_retriever,134,3727,20070
95,866450705531457537,2017-05-22 00:28:40,"This is Jamesy. He gives a kiss to every other pupper he sees on his walk. 13/10 such passion, much tender https://t.co/wk7TfysWHr",13,10,False,False,True,False,French_bulldog,106,32883,106827
115,859607811541651456,2017-05-03 03:17:27,Sorry for the lack of posts today. I came home from school and had to spend quality time with my puppo. Her name is Zoey and she's 13/10 https://t.co/BArWupFAn0,13,10,False,False,False,True,golden_retriever,136,1704,19476
116,858843525470990336,2017-05-01 00:40:27,I have stumbled puppon a doggo painting party. They're looking to be the next Pupcasso or Puppollock. All 13/10 would put it on the fridge https://t.co/cUeDMlHJbq,13,10,True,False,False,True,golden_retriever,138,3771,16304
127,855851453814013952,2017-04-22 18:31:02,Here's a puppo participating in the #ScienceMarch. Cleverly disguising her own doggo agenda. 13/10 would keep the planet habitable for https://t.co/cMhq16isel,13,10,True,False,False,True,flat-coated_retriever,134,19196,47844
132,854120357044912130,2017-04-17 23:52:16,Sometimes you guys remind me just how impactful a pupper can be. Cooper will be remembered as a good boy by so many. 14/10 rest easy friend https://t.co/oBL7LEJEzR,14,10,False,False,True,False,black-and-tan_coonhound,139,8285,33911
133,854010172552949760,2017-04-17 16:34:26,"At first I thought this was a shy doggo, but it's actually a Rare Canadian Floofer Owl. Amateurs would confuse the two. 11/10 only send dogs https://t.co/TXdT3tmuYk",11,10,True,True,False,False,English_springer,140,3433,17169
142,850019790995546112,2017-04-06 16:18:05,Say hello to Boomer. He's a sandy pupper. Having a h*ckin blast. 12/10 would pet passionately https://t.co/ecb3LvExde,12,10,False,False,True,False,Shetland_sheepdog,93,5459,21944
153,846514051647705089,2017-03-28 00:07:32,This is Barney. He's an elder doggo. Hitches a ride when he gets tired. Waves goodbye before he leaves. 13/10 please come back soon https://t.co/cFAasDXauK,13,10,True,False,False,False,golden_retriever,131,13076,48410
158,845397057150107648,2017-03-24 22:08:59,"Say hello to Mimosa. She's an emotional support doggo who helps her owner with PTSD. 13/10, but she needs your help

https://t.co/L6mLzrd7Mx https://t.co/jMutBFdw5o",13,10,True,False,False,False,Dandie_Dinmont,140,2072,8241
159,845306882940190720,2017-03-24 16:10:40,This is Pickles. She's a silly pupper. Thinks she's a dish. 12/10 would dry https://t.co/7mPCF4ZwEk,12,10,False,False,True,False,Irish_water_spaniel,75,6039,25225
181,837820167694528512,2017-03-04 00:21:08,"Here's a pupper before and after being asked ""who's a good girl?"" Unsure as h*ck. 12/10 hint hint it's you https://t.co/ORiK6jlgdH",12,10,False,False,True,False,golden_retriever,106,8952,37277
183,837366284874571778,2017-03-02 18:17:34,This is Lucy. She has a portrait of herself on her ear. Excellent for identification pupposes. 13/10 innovative af https://t.co/uNmxbL2lns,13,10,False,False,False,True,American_Staffordshire_terrier,114,6005,23074
184,837110210464448512,2017-03-02 01:20:01,This is Clark. He passed pupper training today. Round of appaws for Clark. 13/10 https://t.co/7pUjwe8X6B,13,10,False,False,True,False,Siberian_husky,80,2731,17480
197,833124694597443584,2017-02-19 01:23:00,This is Gidget. She's a spy pupper. Stealthy as h*ck. Must've slipped pup and got caught. 12/10 would forgive then pet https://t.co/zD97KYFaFa,12,10,False,False,True,False,Cardigan,118,5513,22133
198,832998151111966721,2017-02-18 17:00:10,"This is Rhino. He arrived at a shelter with an elaborate doggo manual for his new family, written by someone who will always love him. 13/10 https://t.co/QX1h0oqMz0",13,10,True,False,False,False,boxer,140,2522,14549
203,832273440279240704,2017-02-16 17:00:25,Say hello to Smiley. He's a blind therapy doggo having a h*ckin blast high steppin around in the snow. 14/10 would follow anywhere https://t.co/SHAb1wHjMz,14,10,True,False,False,False,Pembroke,130,2673,12385
204,832032802820481025,2017-02-16 01:04:13,"This is Miguel. He was the only remaining doggo at the adoption center after the weekend. Let's change that. 12/10

https://t.co/P0bO8mCQwN https://t.co/SU4K34NT4M",12,10,True,False,False,False,whippet,139,4746,13887
205,831939777352105988,2017-02-15 18:54:34,This is Emanuel. He's a h*ckin rare doggo. Dwells in a semi-urban environment. Round features make him extra collectible. 12/10 would so pet https://t.co/k9bzgyVdUT,12,10,True,False,False,False,Pomeranian,140,7031,26404
210,831322785565769729,2017-02-14 02:02:51,This is Pete. He has no eyes. Needs a guide doggo. Also appears to be considerably fluffy af. 12/10 would hug softly https://t.co/Xc0gyovCtK,12,10,True,False,False,False,Old_English_sheepdog,116,1744,10042
211,831315979191906304,2017-02-14 01:35:49,I couldn't make it to the #WKCDogShow BUT I have people there on the ground relaying me the finest pupper pics possible. 13/10 for all https://t.co/jd6lYhfdH4,13,10,False,False,True,False,briard,134,1264,7117
219,829449946868879360,2017-02-08 22:00:52,Here's a stressed doggo. Had a long day. Many things on her mind. The hat communicates these feelings exquisitely. 11/10 https://t.co/fmRS43mWQB,11,10,True,False,False,False,Labrador_retriever,120,2329,11519
220,829374341691346946,2017-02-08 17:00:26,This is Astrid. She's a guide doggo in training. 13/10 would follow anywhere https://t.co/xo7FZFIAao,13,10,True,False,False,False,Staffordshire_bullterrier,76,10706,38074
225,828381636999917570,2017-02-05 23:15:47,Meet Doobert. He's a deaf doggo. Didn't stop him on the field tho. Absolute legend today. 14/10 would pat head approvingly https://t.co/iCk7zstRA9,14,10,True,False,False,False,Bedlington_terrier,122,2554,13864
229,827933404142436356,2017-02-04 17:34:40,This is Kona. Yesterday she stopped by the department to see what it takes to be a police pupper. 12/10 vest was only a smidge too big https://t.co/j8D3PQJvpJ,12,10,False,False,True,False,German_shepherd,134,5987,22180
234,826958653328592898,2017-02-02 01:01:21,This is Loki. He smiles like Elvis. Ain't nothin but a hound doggo. 12/10 https://t.co/QV5nx6otZR,12,10,True,False,False,False,golden_retriever,73,5757,23767
235,826848821049180160,2017-02-01 17:44:55,This is Cupid. He was found in the trash. Now he's well on his way to prosthetic front legs and a long happy doggo life. 13/10 heroic af https://t.co/WS0Gha8vRh,13,10,True,False,False,False,Great_Pyrenees,136,11878,40325
237,826476773533745153,2017-01-31 17:06:32,This is Pilot. He has mastered the synchronized head tilt and sneaky tongue slip. Usually not unlocked until later doggo days. 12/10 https://t.co/YIV8sw8xkh,12,10,True,False,False,False,German_shepherd,132,4821,20275
239,826204788643753985,2017-01-30 23:05:46,"Here's a little more info on Dew, your favorite roaming doggo that went h*ckin viral. 13/10 
https://t.co/1httNYrCeW https://t.co/KvaM8j3jhX",13,10,True,False,False,False,Labrador_retriever,116,1075,5361
241,825535076884762624,2017-01-29 02:44:34,Here's a very loving and accepting puppo. Appears to have read her Constitution well. 14/10 would pat head approvingly https://t.co/6ao80wIpV1,14,10,False,False,False,True,Rottweiler,118,19669,56413
243,825026590719483904,2017-01-27 17:04:02,"Say hello to Pablo. He's one gorgeous puppo. A true 12/10. Click the link to see why Pablo requests your assistance

https://t.co/koHvVQp9bL https://t.co/IhW0JKf7kc",12,10,False,False,False,True,Eskimo_dog,140,1483,7020
246,824325613288833024,2017-01-25 18:38:36,Retweet the h*ck out of this 13/10 pupper #BellLetsTalk https://t.co/wBmc7OaGvS,13,10,False,False,True,False,Pembroke,55,11848,12999
249,822872901745569793,2017-01-21 18:26:02,Here's a super supportive puppo participating in the Toronto  #WomensMarch today. 13/10 https://t.co/nTz3FtorBc,13,10,False,False,False,True,Lakeland_terrier,87,48265,132810
253,822462944365645825,2017-01-20 15:17:01,"This is Gabe. He was the unequivocal embodiment of a dream meme, but also one h*ck of a pupper. You will be missed by so many. 14/10 RIP https://t.co/M3hZGadUuO",14,10,False,False,True,False,Pomeranian,136,17209,31800
256,821765923262631936,2017-01-18 17:07:18,This is Duchess. She uses dark doggo forces to levitate her toys. 13/10 magical af https://t.co/maDNMETA52,13,10,True,False,False,False,golden_retriever,82,1899,9317
258,821407182352777218,2017-01-17 17:21:47,This is Sundance. He's a doggo drummer. Even sings a bit on the side. 14/10 entertained af (vid by @sweetsundance) https://t.co/Xn5AQtiqzG,14,10,True,False,False,False,Irish_setter,114,5053,13075
260,821107785811234820,2017-01-16 21:32:06,Here's a doggo who looks like he's about to give you a list of mythical ingredients to go collect for his potion. 11/10 would obey https://t.co/8SiwKDlRcl,11,10,True,False,False,False,Pomeranian,130,2487,10645
264,819952236453363712,2017-01-13 17:00:21,"This is Oliver. He has dreams of being a service puppo so he can help his owner. 13/10 selfless af

make it happen:
https://t.co/f5WMsx0a9K https://t.co/6lJz0DKZIb",13,10,False,False,False,True,American_Staffordshire_terrier,139,1369,5927
268,819004803107983360,2017-01-11 02:15:36,This is Bo. He was a very good First Doggo. 14/10 would be an absolute honor to pet https://t.co/AdPKrI8BZ1,14,10,True,False,False,False,standard_poodle,83,42228,95450
274,817777686764523521,2017-01-07 16:59:28,"This is Dido. She's playing the lead role in ""Pupper Stops to Catch Snow Before Resuming Shadow Box with Dried Apple."" 13/10 (IG: didodoggo) https://t.co/m7isZrOBX7",13,10,True,False,True,False,curly-coated_retriever,140,3084,11901
284,815990720817401858,2017-01-02 18:38:42,"Meet Jack. He's one of the rare doggos that doesn't mind baths. 11/10 click the link to see how you can help Jack!

https://t.co/r4W111FzAq https://t.co/fQpYuMKG3p",11,10,True,False,False,False,Chihuahua,139,1207,5545
285,815966073409433600,2017-01-02 17:00:46,Here's a pupper with squeaky hiccups. Please enjoy. 13/10 https://t.co/MiMKtsLN6k,13,10,False,False,True,False,Tibetan_mastiff,57,9907,25057
288,814986499976527872,2016-12-31 00:08:17,This is Cooper. Someone attacked him with a sharpie. Poor pupper. 11/10 nifty tongue slip tho https://t.co/01vpuRDXQ8,11,10,False,False,True,False,dalmatian,93,1505,8485
292,813910438903693312,2016-12-28 00:52:25,This is Chubbs. He dug a hole and now he's stuck in it. Dang h*ckin doggo. 11/10 would assist https://t.co/z1VRj1cYZf,11,10,True,False,False,False,Siberian_husky,93,2194,10342
296,813202720496779264,2016-12-26 02:00:11,Here's a doggo who has concluded that Christmas is entirely too bright. Requests you tone it down a notch. 11/10 https://t.co/cD967DjnIn,11,10,True,False,False,False,cocker_spaniel,112,2090,10192
299,813127251579564032,2016-12-25 21:00:18,Here's an anonymous doggo that appears to be very done with Christmas. 11/10 cheer up pup https://t.co/BzITyGw3JA,11,10,True,False,False,False,Norwegian_elkhound,89,3652,13242
300,813096984823349248,2016-12-25 19:00:02,This is Rocky. He got triple-doggo-dared. Stuck af. 11/10 someone help him https://t.co/soNL00XWVu,11,10,True,False,False,False,Great_Dane,74,4207,11694
310,811386762094317568,2016-12-21 01:44:13,This is Craig. That's actually a normal sized fence he's stuck on. H*ckin massive pupper. 11/10 someone help him https://t.co/aAUXzoxaBy,11,10,False,False,True,False,Pembroke,112,7444,23302
321,808106460588765185,2016-12-12 00:29:28,Here we have Burke (pupper) and Dexter (doggo). Pupper wants to be exactly like doggo. Both 12/10 would pet at same time https://t.co/ANBpEYHaho,12,10,True,False,True,False,golden_retriever,120,2525,9701
323,807621403335917568,2016-12-10 16:22:02,This is Ollie Vue. He was a 3 legged pupper on a mission to overcome everything. This is very hard to write. 14/10 we will miss you Ollie https://t.co/qTRY2qX9y4,14,10,False,False,True,False,golden_retriever,137,4288,16236
329,805826884734976000,2016-12-05 17:31:15,This is Duke. He is not a fan of the pupporazzi. 12/10 https://t.co/SgpBVYIL18,12,10,False,False,False,True,Siberian_husky,54,2132,7335
333,803773340896923648,2016-11-30 01:31:12,This is Diogi. He fell in the pool as soon as he was brought home. Clumsy puppo. 12/10 would pet until dry https://t.co/ZxeRjMKaWt,12,10,False,False,False,True,miniature_pinscher,106,3220,11203
334,803638050916102144,2016-11-29 16:33:36,Pupper hath acquire enemy. 13/10 https://t.co/ns9qoElfsX,13,10,False,False,True,False,Labrador_retriever,32,4828,12270
338,802265048156610565,2016-11-25 21:37:47,"Like doggo, like pupper version 2. Both 11/10 https://t.co/9IxWAXFqze",11,10,True,False,True,False,Labrador_retriever,45,1573,7039
339,802239329049477120,2016-11-25 19:55:35,This is Loki. He'll do your taxes for you. Can also make room in your budget for all the things you bought today. 12/10 what a puppo https://t.co/5oWrHCWg87,12,10,False,False,False,True,Eskimo_dog,132,3040,10132
343,801115127852503040,2016-11-22 17:28:25,This is Bones. He's being haunted by another doggo of roughly the same size. 12/10 deep breaths pupper everything's fine https://t.co/55Dqe0SJNj,12,10,True,False,True,False,dalmatian,120,2429,8992
346,800388270626521089,2016-11-20 17:20:08,This is Doc. He takes time out of every day to worship our plant overlords. 12/10 quite the floofer https://t.co/azMneS6Ly5,12,10,False,True,False,False,golden_retriever,99,3265,12456
348,799757965289017345,2016-11-18 23:35:32,This is Sobe. She's a h*ckin happy doggo. Only one leg tho. Must have good balance. 13/10 would smile back https://t.co/OiH8PaOxB1,13,10,True,False,False,False,Border_collie,106,2506,9390
355,797971864723324932,2016-11-14 01:18:12,Here's a helicopter pupper. He takes off at random. H*ckin hard to control. 12/10 rare af https://t.co/GRWPgNKt2z,12,10,False,False,True,False,American_Staffordshire_terrier,89,3652,13018
360,796484825502875648,2016-11-09 22:49:15,Here's a sleepy doggo that requested some assistance. 12/10 would carry everywhere https://t.co/bvkkqOjNDV,12,10,True,False,False,False,cocker_spaniel,82,2042,8472
366,795464331001561088,2016-11-07 03:14:10,Elder doggo does a splash. Both 13/10 incredible stuff https://t.co/gBUDjdEcqz,13,10,True,False,False,False,golden_retriever,54,27728,55683
378,793195938047070209,2016-10-31 21:00:23,Say hello to Lily. She's pupset that her costume doesn't fit as well as last year. 12/10 poor puppo https://t.co/YSi6K1firY,12,10,False,False,False,True,Labrador_retriever,99,6547,17063
403,787717603741622272,2016-10-16 18:11:26,This is Tonks. She is a service puppo. Can hear a caterpillar hiccup from 7 miles away. 13/10 would follow anywhere https://t.co/i622ZbWkUp,13,10,False,False,False,True,German_shepherd,115,3240,11416
409,786363235746385920,2016-10-13 00:29:39,This is Rizzo. He has many talents. A true renaissance doggo. 13/10 entertaining af https://t.co/TVXpEJB7Wn,13,10,True,False,False,False,golden_retriever,83,4072,12189
422,782747134529531904,2016-10-03 01:00:34,This is Deacon. He's the happiest almost dry doggo I've ever seen. 11/10 would smile back https://t.co/C6fUMnHt1H,11,10,True,False,False,False,golden_retriever,89,1604,8310
425,782305867769217024,2016-10-01 19:47:08,This is Sampson. He just graduated. Ready to be a doggo now. Time for the real world. 12/10 have fun with taxes https://t.co/pgVKxRw0s1,12,10,True,False,False,False,briard,111,6470,18630
445,778039087836069888,2016-09-20 01:12:28,Evolution of a pupper yawn featuring Max. 12/10 groundbreaking stuff https://t.co/t8Y4x9DmVD,12,10,False,False,True,False,German_shepherd,68,3065,9417
446,778027034220126208,2016-09-20 00:24:34,This is Sophie. She's a Jubilant Bush Pupper. Super h*ckin rare. Appears at random just to smile at the locals. 11.27/10 would smile back https://t.co/QFaUiIHxHq,27,10,False,False,True,False,clumber,137,1885,7320
452,776477788987613185,2016-09-15 17:48:25,This is Huck. He's addicted to caffeine. Hope it's not too latte to seek help. 11/10 stay strong pupper https://t.co/iJE3F0VozW,11,10,False,False,True,False,Labrador_retriever,103,3249,9858
453,776218204058357768,2016-09-15 00:36:55,Atlas rolled around in some chalk and now he's a magical rainbow floofer. 13/10 please never take a bath https://t.co/nzqTNw0744,13,10,False,True,False,False,Samoyed,104,18497,33345
456,775364825476165632,2016-09-12 16:05:54,This is Finley. He's an independent doggo still adjusting to life on his own. 11/10 https://t.co/7FNcBaKbci,11,10,True,False,False,False,beagle,83,3472,8295
464,773547596996571136,2016-09-07 15:44:53,This is Chelsea. She forgot how to dog. 11/10 get it together pupper https://t.co/nBJ5RE4yHb,11,10,False,False,True,False,Norwegian_elkhound,68,7126,24553
468,772193107915964416,2016-09-03 22:02:38,This is Willem. He's a Penn State pupper. Thinks the hood makes him more intimidating. It doesn't. 12/10 https://t.co/Dp0s7MRIHK,12,10,False,False,True,False,Pembroke,104,1612,6665
501,765371061932261376,2016-08-16 02:14:15,This is Louie. He's had a long day. Did a lot of pupper things. Also appears to be rather heckin pettable. 11/10 https://t.co/w2qDmoTIZ5,11,10,False,False,True,False,golden_retriever,112,2475,7842
515,760893934457552897,2016-08-03 17:43:45,This is Wishes. He has the day off. Daily struggles of being a doggo have finally caught up with him. 11/10 https://t.co/H9YgrUkYwa,11,10,True,False,False,False,Blenheim_spaniel,107,1104,4228
521,759793422261743616,2016-07-31 16:50:42,"Meet Maggie &amp; Lila. Maggie is the doggo, Lila is the pupper. They are sisters. Both 12/10 would pet at the same time https://t.co/MYwR4DQKll",12,10,True,False,True,False,golden_retriever,120,2173,6620
527,758828659922702336,2016-07-29 00:57:05,This doggo is just waiting for someone to be proud of her and her accomplishment. 13/10 legendary af https://t.co/9T2h14yn4Q,13,10,True,False,False,False,Chesapeake_Bay_retriever,100,4376,12376
533,757393109802180609,2016-07-25 01:52:43,Here's a doggo completely oblivious to the double rainbow behind him. 10/10 someone tell him https://t.co/OfvRoD6ndV,10,10,True,False,False,False,Labrador_retriever,92,2009,6462
536,756939218950160384,2016-07-23 19:49:07,This is Jax. He is a majestic mountain pupper. Thinks flat ground is for the weak. 12/10 would totally hike with https://t.co/KGdeHuFJnH,12,10,False,False,True,False,golden_retriever,112,2295,7342
539,756275833623502848,2016-07-21 23:53:04,When ur older siblings get to play in the deep end but dad says ur not old enough. Maybe one day puppo. All 10/10 https://t.co/JrDAzMhwG9,10,10,False,False,False,True,Airedale,113,1738,7114
540,755955933503782912,2016-07-21 02:41:54,Here's a frustrated pupper attempting to escape a pool of Frosted Flakes. 12/10 https://t.co/GAYViEweWr,12,10,False,False,True,False,Pekinese,79,3285,8092
552,752682090207055872,2016-07-12 01:52:49,Nothing better than a doggo and a sunset. 10/10 majestic af https://t.co/xVSodF19PS,10,10,True,False,False,False,German_shepherd,59,1846,6642
553,752334515931054080,2016-07-11 02:51:40,Here's a doggo trying to catch some fish. 8/10 futile af (vid by @KellyBauerx) https://t.co/jwd0j6oWLE,8,10,True,False,False,False,Bedlington_terrier,78,1263,4238
558,751583847268179968,2016-07-09 01:08:47,Please stop sending it pictures that don't even have a doggo or pupper in them. Churlish af. 5/10 neat couch tho https://t.co/u2c9c7qSg8,5,10,True,False,True,False,dalmatian,112,1265,4849
560,751456908746354688,2016-07-08 16:44:23,Here's a pupper that's very hungry but too lazy to get up and eat. 12/10 (vid by @RealDavidCortes) https://t.co/lsVAMBq6ex,12,10,False,False,True,False,golden_retriever,98,1127,3516
563,751132876104687617,2016-07-07 19:16:47,This is Cooper. He's just so damn happy. 10/10 what's your secret puppo? https://t.co/yToDwVXEpA,10,10,False,False,False,True,Labrador_retriever,72,1480,5610
564,750868782890057730,2016-07-07 01:47:22,Meet Milo. He hauled ass until he ran out of treadmill and then passed out from exhaustion. 11/10 sleep tight pupper https://t.co/xe1aGZNkcC,11,10,False,False,True,False,toy_poodle,116,1595,5306
567,750383411068534784,2016-07-05 17:38:41,This is Zoe. She was trying to stealthily take a picture of you but you just noticed. 9/10 not so sneaky pupper https://t.co/FfH3o88Vta,9,10,False,False,True,False,Border_collie,111,1309,5005
