,tweet_id,timestamp,text,rating_numerator,rating_denominator,doggo,floofer,pupper,puppo,dog_breed,display_text_range,retweet_count,favorite_count
1186,674262580978937856,2015-12-08 16:21:41,This is Gus. He's super stoked about being an elephant. Couldn't be happier. 9/10 for elephant pupper https://t.co/gJS1qU0jP7,9,10,False,False,True,False,Greater_Swiss_Mountain_dog,125,498,1391
1193,674038233588723717,2015-12-08 01:30:12,This is Kaiya. She's an aspiring shoe model. 12/10 follow your dreams pupper https://t.co/nX8FiGRHvk,12,10,False,False,True,False,Eskimo_dog,100,456,1176
1198,673956914389192708,2015-12-07 20:07:04,This is one esteemed pupper. Just graduated college. 10/10 what a champ https://t.co/nyReCVRiyd,10,10,False,False,True,False,pug,95,1069,2091
1203,673707060090052608,2015-12-07 03:34:14,This is Raymond. He's absolutely terrified of floating tennis ball. 10/10 it'll be ok pupper https://t.co/QyH1CaY3SM,10,10,False,False,True,False,German_short-haired_pointer,116,434,1177
1210,673656262056419329,2015-12-07 00:12:23,This is Albert AKA King Banana Peel. He's a kind ruler of the kitchen. Very jubilant pupper. 10/10 overall great dog https://t.co/PN8hxgZ9We,10,10,False,False,True,False,bull_mastiff,140,265,769
1211,673612854080196609,2015-12-06 21:19:54,This is Jeffri. He's a speckled ice pupper. Very lazy. Enjoys the occasional swim. Rather majestic really. 7/10 https://t.co/0iyItbtkr8,7,10,False,False,True,False,Newfoundland,135,802,1691
1220,673295268553605120,2015-12-06 00:17:55,Meet Eve. She's a raging alcoholic 8/10 (would b 11/10 but pupper alcoholism is a tragic issue that I can't condone) https://t.co/U36HYQIijg,8,10,False,False,True,False,golden_retriever,140,3484,8046
1226,672988786805112832,2015-12-05 04:00:04,This is Schnozz. He's had a blurred tail since birth. Hasn't let that stop him. 10/10 inspirational pupper https://t.co/a3zYMcvbXG,10,10,False,False,True,False,Lakeland_terrier,130,314,1039
1227,672975131468300288,2015-12-05 03:05:49,This is Chuckles. He is one skeptical pupper. 10/10 stay woke Chuckles https://t.co/ZlcF0TIRW1,10,10,False,False,True,False,pug,94,1015,1813
1233,672622327801233409,2015-12-04 03:43:54,This lil pupper is sad because we haven't found Kony yet. RT to spread awareness. 12/10 would pet firmly https://t.co/Cv7dRdcMvQ,12,10,False,False,True,False,golden_retriever,128,542,1377
1235,672594978741354496,2015-12-04 01:55:13,Meet Scott. Just trying to catch his train to work. Doesn't need everybody staring. 9/10 ignore the haters pupper https://t.co/jyXbZ35MYz,9,10,False,False,True,False,Great_Pyrenees,137,661,1411
1240,672481316919734272,2015-12-03 18:23:34,Say hello to Jazz. She should be on the cover of Vogue. 12/10 gorgeous pupper https://t.co/mVCMemhXAP,12,10,False,False,True,False,Border_collie,101,137,757
1245,672254177670729728,2015-12-03 03:21:00,This is Rolf. He's having the time of his life. 11/10 good pupper https://t.co/OO6MqEbqG3,11,10,False,False,True,False,pug,89,800,1515
1251,672160042234327040,2015-12-02 21:06:56,This is Bubba. He's a Titted Peebles Aorta. Evolutionary masterpiece. Comfortable with his body. 8/10 great pupper https://t.co/aNkkl5nH3W,8,10,False,False,True,False,pug,138,395,918
